{
  "sys_id": "500123",
  "name": "Example Title",
  "sys_class_name": "example_value",
  "category": "example_value",
  "subcategory": "example_value",
  "operational_status": "1",
  "install_status": "example_value",
  "serial_number": "example_value",
  "asset_tag": "example_value",
  "ip_address": "example_value",
  "mac_address": "example_value",
  "dns_domain": "example_value",
  "fqdn": "example_value",
  "os": "example_value",
  "os_version": "example_value",
  "manufacturer": "example_value",
  "model_id": "500123",
  "location": "example_value",
  "department": "example_value",
  "company": "example_value",
  "assigned_to": "example_value",
  "managed_by": "example_value",
  "owned_by": "example_value",
  "support_group": "example_value",
  "sys_created_on": "2026-01-15T10:30:00Z",
  "sys_updated_on": "2026-01-15T10:30:00Z"
}